title,url,tags,desc,links,prereqTags,prereqItems
3Blue1Brown — Essence of Calculus,https://www.3blue1brown.com/topics/calculus,calculus;derivatives;integrals;visual,Intuitive calculus series with animations.,Topic Overview|https://www.3blue1brown.com/topics/calculus,functions;algebra,
Paul's Online Math Notes — Trig,https://tutorial.math.lamar.edu/Classes/Alg/TrigFunctions.aspx,trigonometry;identities;precalculus,"Definitions, graphs, identities, and practice.",Main page|https://tutorial.math.lamar.edu/,right triangles;functions,
MIT OCW — Single Variable Calculus,https://ocw.mit.edu/courses/18-01-single-variable-calculus-fall-2006/,calculus;university;lecture,"Full course with lectures, notes, and problem sets.",Course Home|https://ocw.mit.edu/courses/18-01-single-variable-calculus-fall-2006/,algebra;precalculus,Paul's Online Math Notes — Trig
Khan Academy — Vectors & Matrices,https://www.khanacademy.org/math/linear-algebra,linear algebra;vectors;matrices,"Vectors, matrices, transformations with practice.",,algebra,
Wolfram MathWorld — Trigonometry,https://mathworld.wolfram.com/topics/Trigonometry.html,trigonometry;reference,Reference entries on trig topics.,,functions,
